{
  "$schema": "https://json-schema.org/draft/2020-12/schema",
  "$id": "https://raw.githubusercontent.com/brasilspace/prilog-pex/main/schema/pex.schema.json",
  "title": "PEX – Prilog Education Exchange (school system package)",
  "type": "object",
  "required": [
    "meta"
  ],
  "additionalProperties": false,
  "properties": {
    "meta": {
      "type": "object",
      "required": [
        "format",
        "id",
        "version",
        "country",
        "languages",
        "name"
      ],
      "additionalProperties": false,
      "properties": {
        "format": {
          "const": "pex"
        },
        "schema": {
          "type": "string",
          "format": "uri"
        },
        "id": {
          "type": "string",
          "pattern": "^[a-z0-9-]+$"
        },
        "version": {
          "type": "string",
          "pattern": "^\\d+\\.\\d+\\.\\d+$"
        },
        "kind": {
          "enum": [
            "base",
            "overlay"
          ],
          "default": "base"
        },
        "extends": {
          "anyOf": [
            {
              "type": "string"
            },
            {
              "type": "array",
              "items": {
                "type": "string"
              },
              "minItems": 1
            }
          ],
          "description": "id(s) des Basis-Pakets, auf das dieses Overlay legbar ist (nur bei overlay). \"*\" = jede Basis"
        },
        "country": {
          "type": "string",
          "pattern": "^[A-Z]{2}$"
        },
        "region": {
          "type": "string",
          "description": "Kanton / Bundesland / State, ISO 3166-2 Suffix"
        },
        "languages": {
          "type": "array",
          "items": {
            "type": "string"
          },
          "minItems": 1
        },
        "name": {
          "$ref": "#/$defs/label"
        },
        "source": {
          "type": "string"
        },
        "notes": {
          "type": "string"
        },
        "license": {
          "type": "string",
          "description": "SPDX identifier of the package data, e.g. CC-BY-4.0"
        },
        "maintainer": {
          "type": "string",
          "description": "contact for corrections, e.g. info@prilog.team"
        }
      }
    },
    "terminology": {
      "type": "object",
      "description": "Sichtbare Begriffe; Schlüssel sind stabil, Werte mehrsprachig",
      "additionalProperties": {
        "$ref": "#/$defs/label"
      }
    },
    "calendar": {
      "type": "object",
      "additionalProperties": false,
      "properties": {
        "year_start_month": {
          "type": "integer",
          "minimum": 1,
          "maximum": 12
        },
        "periods": {
          "type": "array",
          "items": {
            "type": "object",
            "required": [
              "id",
              "label",
              "months"
            ],
            "properties": {
              "id": {
                "$ref": "#/$defs/id"
              },
              "label": {
                "$ref": "#/$defs/label"
              },
              "months": {
                "type": "array",
                "items": {
                  "type": "integer"
                },
                "minItems": 2,
                "maxItems": 2
              },
              "disabled": {
                "type": "boolean"
              }
            }
          }
        },
        "report_points": {
          "type": "array",
          "items": {
            "$ref": "#/$defs/id"
          }
        },
        "report_points_by_program": {
          "type": "array",
          "items": {
            "type": "object",
            "required": [
              "program",
              "report_points"
            ],
            "properties": {
              "program": {
                "$ref": "#/$defs/id"
              },
              "report_points": {
                "type": "array",
                "items": {
                  "$ref": "#/$defs/id"
                }
              }
            }
          }
        },
        "holiday_authority": {
          "type": "object",
          "properties": {
            "level": {
              "enum": [
                "state",
                "canton",
                "municipality",
                "school",
                "federal"
              ]
            },
            "label": {
              "$ref": "#/$defs/label"
            },
            "url": {
              "type": "string",
              "format": "uri"
            }
          }
        }
      }
    },
    "grading": {
      "type": "object",
      "additionalProperties": false,
      "properties": {
        "default_scale": {
          "$ref": "#/$defs/id"
        },
        "scales": {
          "type": "array",
          "items": {
            "type": "object",
            "required": [
              "id",
              "label",
              "kind"
            ],
            "properties": {
              "id": {
                "$ref": "#/$defs/id"
              },
              "label": {
                "$ref": "#/$defs/label"
              },
              "kind": {
                "enum": [
                  "numeric",
                  "letter",
                  "points",
                  "percent",
                  "text"
                ]
              },
              "values": {
                "type": "array",
                "items": {
                  "type": [
                    "string",
                    "number"
                  ]
                }
              },
              "step": {
                "type": "number"
              },
              "best": {
                "type": [
                  "string",
                  "number"
                ]
              },
              "pass": {
                "type": [
                  "string",
                  "number"
                ]
              },
              "gpa": {
                "type": "object",
                "additionalProperties": {
                  "type": "number"
                }
              },
              "disabled": {
                "type": "boolean"
              },
              "tendencies": {
                "type": "boolean",
                "description": "Noten mit + / – Tendenz"
              }
            }
          }
        },
        "head_marks": {
          "type": "array",
          "items": {
            "type": "object",
            "required": [
              "id",
              "label"
            ],
            "properties": {
              "id": {
                "$ref": "#/$defs/id"
              },
              "label": {
                "$ref": "#/$defs/label"
              },
              "scale": {
                "$ref": "#/$defs/id"
              },
              "disabled": {
                "type": "boolean"
              }
            }
          },
          "description": "Kopfnoten (Arbeits-/Sozialverhalten)"
        },
        "by_program": {
          "type": "array",
          "items": {
            "type": "object",
            "required": [
              "program",
              "scale"
            ],
            "properties": {
              "program": {
                "$ref": "#/$defs/id"
              },
              "grades": {
                "type": "array",
                "items": {
                  "$ref": "#/$defs/id"
                }
              },
              "scale": {
                "$ref": "#/$defs/id"
              }
            }
          },
          "description": "Skala je Programm/Jahrgang, z. B. Berichtszeugnis bis Kl. 2"
        }
      }
    },
    "stages": {
      "type": "array",
      "items": {
        "$ref": "#/$defs/stage"
      }
    },
    "grades": {
      "type": "array",
      "items": {
        "$ref": "#/$defs/grade"
      }
    },
    "programs": {
      "type": "array",
      "items": {
        "$ref": "#/$defs/program"
      }
    },
    "tracks": {
      "type": "array",
      "items": {
        "$ref": "#/$defs/track"
      }
    },
    "qualifications": {
      "type": "array",
      "items": {
        "$ref": "#/$defs/qualification"
      }
    },
    "subject_domains": {
      "type": "array",
      "items": {
        "$ref": "#/$defs/named"
      }
    },
    "subjects": {
      "type": "array",
      "items": {
        "$ref": "#/$defs/subject"
      }
    },
    "rules": {
      "type": "array",
      "items": {
        "$ref": "#/$defs/rule"
      }
    },
    "exams": {
      "type": "array",
      "items": {
        "$ref": "#/$defs/exam"
      }
    },
    "legal": {
      "type": "array",
      "items": {
        "$ref": "#/$defs/legal"
      }
    }
  },
  "$defs": {
    "id": {
      "type": "string",
      "pattern": "^[a-z0-9][a-z0-9-]*$"
    },
    "label": {
      "type": "object",
      "description": "Sprachcode → Text; mindestens eine Sprache aus meta.languages",
      "minProperties": 1,
      "additionalProperties": {
        "type": "string"
      }
    },
    "named": {
      "type": "object",
      "required": [
        "id",
        "label"
      ],
      "properties": {
        "id": {
          "$ref": "#/$defs/id"
        },
        "label": {
          "$ref": "#/$defs/label"
        },
        "disabled": {
          "type": "boolean"
        }
      }
    },
    "stage": {
      "allOf": [
        {
          "$ref": "#/$defs/named"
        }
      ],
      "properties": {
        "ordinal": {
          "type": "integer"
        },
        "grades": {
          "type": "array",
          "items": {
            "$ref": "#/$defs/id"
          }
        }
      }
    },
    "grade": {
      "allOf": [
        {
          "$ref": "#/$defs/named"
        }
      ],
      "properties": {
        "ordinal": {
          "type": "integer"
        },
        "stage": {
          "$ref": "#/$defs/id"
        },
        "typical_age": {
          "type": "integer"
        },
        "aliases": {
          "type": "array",
          "items": {
            "type": "string"
          }
        }
      }
    },
    "track": {
      "allOf": [
        {
          "$ref": "#/$defs/named"
        }
      ],
      "required": [
        "scope",
        "levels"
      ],
      "properties": {
        "scope": {
          "enum": [
            "learning_group",
            "enrollment",
            "learner",
            "program"
          ],
          "description": "learning_group: Zug hängt an der Gruppe (Sek A ist eine Klasse); enrollment: Niveau je Teilnahme Person×Kurs (Mathe A, LK); learner: individueller Pfad je Person; program: Variante des Programms (Langzeit-/Kurzzeitgymnasium)"
        },
        "levels": {
          "type": "array",
          "items": {
            "$ref": "#/$defs/named"
          },
          "minItems": 2
        }
      }
    },
    "qualification": {
      "allOf": [
        {
          "$ref": "#/$defs/named"
        }
      ],
      "properties": {
        "after_grade": {
          "$ref": "#/$defs/id"
        },
        "grants_access": {
          "type": "array",
          "items": {
            "type": "string"
          }
        },
        "requirements": {
          "type": "object",
          "description": "frei, z. B. Credits je Domain",
          "additionalProperties": true
        },
        "programs": {
          "type": "array",
          "items": {
            "$ref": "#/$defs/id"
          }
        }
      }
    },
    "subject": {
      "allOf": [
        {
          "$ref": "#/$defs/named"
        }
      ],
      "properties": {
        "domain": {
          "$ref": "#/$defs/id"
        },
        "grades": {
          "type": "array",
          "items": {
            "$ref": "#/$defs/id"
          }
        },
        "kind": {
          "enum": [
            "core",
            "elective",
            "project",
            "remedial",
            "epoch"
          ],
          "default": "core"
        },
        "tracked": {
          "type": "boolean",
          "default": false,
          "description": "true: für dieses Fach gilt ein Track mit scope enrollment"
        },
        "optional": {
          "type": "boolean",
          "default": false
        },
        "credits": {
          "type": "number"
        },
        "aliases": {
          "type": "array",
          "items": {
            "type": "string"
          }
        },
        "short": {
          "$ref": "#/$defs/label"
        },
        "programs": {
          "type": "array",
          "items": {
            "$ref": "#/$defs/id"
          }
        }
      }
    },
    "program": {
      "allOf": [
        {
          "$ref": "#/$defs/named"
        }
      ],
      "properties": {
        "stages": {
          "type": "array",
          "items": {
            "$ref": "#/$defs/id"
          }
        },
        "grades": {
          "type": "array",
          "items": {
            "$ref": "#/$defs/id"
          },
          "description": "Jahrgänge dieses Programms; leer oder fehlend = Programm ohne feste Jahrgangsstufen (Lerngruppe trägt dann age_range)"
        },
        "tracks": {
          "type": "array",
          "items": {
            "$ref": "#/$defs/id"
          }
        },
        "qualifications": {
          "type": "array",
          "items": {
            "$ref": "#/$defs/id"
          }
        },
        "class_model": {
          "enum": [
            "class",
            "homeroom",
            "course",
            "mixed-age"
          ],
          "default": "class",
          "description": "class: feste Jahrgangsklasse; homeroom: Stammgruppe + Kurse; course: nur Kurse; mixed-age: altersgemischte Lerngruppe ohne feste Jahrgangsstufe"
        },
        "aliases": {
          "type": "array",
          "items": {
            "type": "string"
          }
        },
        "notes": {
          "type": "string"
        },
        "age_range": {
          "type": "array",
          "items": {
            "type": "integer"
          },
          "minItems": 2,
          "maxItems": 2,
          "description": "typische Altersspanne, wenn keine grades"
        },
        "duration_years": {
          "type": "number"
        },
        "approval": {
          "enum": [
            "state",
            "private-recognized",
            "private-approved",
            "private-licensed"
          ],
          "description": "Trägerschaft/Genehmigungsstatus – für freie Schulen"
        }
      }
    },
    "rule": {
      "type": "object",
      "required": [
        "id",
        "kind",
        "label",
        "summary",
        "source"
      ],
      "properties": {
        "id": {
          "$ref": "#/$defs/id"
        },
        "kind": {
          "enum": [
            "transition",
            "admission",
            "compulsory-schooling",
            "promotion",
            "subject-choice",
            "attendance",
            "other"
          ]
        },
        "label": {
          "$ref": "#/$defs/label"
        },
        "applies_to": {
          "type": "object",
          "properties": {
            "from_grade": {
              "$ref": "#/$defs/id"
            },
            "to_grade": {
              "$ref": "#/$defs/id"
            },
            "from_program": {
              "$ref": "#/$defs/id"
            },
            "to_program": {
              "$ref": "#/$defs/id"
            },
            "programs": {
              "type": "array",
              "items": {
                "$ref": "#/$defs/id"
              }
            }
          }
        },
        "mode": {
          "type": "string",
          "description": "kleine geschlossene Liste je kind, z. B. transition: parent-choice | binding-recommendation | exam | recommendation-with-probation"
        },
        "summary": {
          "$ref": "#/$defs/label"
        },
        "source": {
          "type": "string"
        },
        "url": {
          "type": "string",
          "format": "uri"
        },
        "disabled": {
          "type": "boolean"
        }
      }
    },
    "exam": {
      "type": "object",
      "required": [
        "id",
        "label",
        "qualification",
        "mode",
        "source"
      ],
      "properties": {
        "id": {
          "$ref": "#/$defs/id"
        },
        "label": {
          "$ref": "#/$defs/label"
        },
        "qualification": {
          "$ref": "#/$defs/id"
        },
        "mode": {
          "enum": [
            "internal",
            "external",
            "central",
            "state-recognized"
          ]
        },
        "at_grade": {
          "$ref": "#/$defs/id"
        },
        "components": {
          "type": "array",
          "items": {
            "type": "object",
            "required": [
              "id"
            ],
            "properties": {
              "id": {
                "enum": [
                  "written",
                  "oral",
                  "practical",
                  "presentation",
                  "thesis"
                ]
              },
              "count": {
                "type": "integer"
              },
              "label": {
                "$ref": "#/$defs/label"
              }
            }
          }
        },
        "summary": {
          "$ref": "#/$defs/label"
        },
        "source": {
          "type": "string"
        },
        "url": {
          "type": "string",
          "format": "uri"
        },
        "disabled": {
          "type": "boolean"
        }
      }
    },
    "legal": {
      "type": "object",
      "required": [
        "id",
        "kind",
        "label"
      ],
      "properties": {
        "id": {
          "$ref": "#/$defs/id"
        },
        "kind": {
          "enum": [
            "school-act",
            "data-protection",
            "authority",
            "retention",
            "reporting",
            "private-school",
            "other"
          ]
        },
        "label": {
          "$ref": "#/$defs/label"
        },
        "summary": {
          "$ref": "#/$defs/label"
        },
        "source": {
          "type": "string"
        },
        "url": {
          "type": "string",
          "format": "uri"
        },
        "sections": {
          "type": "object",
          "additionalProperties": {
            "type": "string"
          }
        },
        "disabled": {
          "type": "boolean"
        }
      }
    }
  },
  "$comment": "PEX – Prilog Education Exchange, schema v2.1. SPDX-License-Identifier: Apache-2.0. Copyright 2026 Prilog (prilog.chat), info@prilog.team"
}