{
  "meta": {
    "format": "pex",
    "schema": "https://raw.githubusercontent.com/brasilspace/prilog-pex/main/schema/pex.schema.json",
    "license": "CC-BY-4.0",
    "maintainer": "info@prilog.team",
    "id": "waldorf",
    "version": "0.2.0",
    "kind": "overlay",
    "extends": [
      "de"
    ],
    "country": "XX",
    "languages": [
      "de"
    ],
    "name": {
      "de": "Waldorfpädagogik (auf jedes Basis-Paket legbar)"
    },
    "notes": "Ändert Begriffe, ergänzt Fächer und Epochenunterricht, fügt Textzeugnis hinzu. Jahrgänge und Abschlüsse kommen aus dem Basis-Paket. Jahrgänge sind als g1–g13 referenziert; für ch-de und at ist ein eigenes Overlay (waldorf-ch, waldorf-at) mit deren Jahrgangs-IDs nötig."
  },
  "terminology": {
    "class_teacher": {
      "de": "Klassenlehrer:in (Kl. 1–8) / Klassenbetreuer:in (ab Kl. 9)"
    },
    "head": {
      "de": "Schulführungskonferenz / Geschäftsführung"
    },
    "report": {
      "de": "Zeugnis (Textzeugnis)"
    },
    "parent_evening": {
      "de": "Elternabend"
    },
    "lesson": {
      "de": "Stunde"
    }
  },
  "grading": {
    "default_scale": "text",
    "scales": [
      {
        "id": "text",
        "label": {
          "de": "Textzeugnis"
        },
        "kind": "text"
      }
    ]
  },
  "subject_domains": [
    {
      "id": "waldorf",
      "label": {
        "de": "Waldorfspezifisch"
      }
    },
    {
      "id": "epoch",
      "label": {
        "de": "Epochen (Hauptunterricht)"
      }
    }
  ],
  "subjects": [
    {
      "id": "eu",
      "label": {
        "de": "Eurythmie"
      },
      "domain": "waldorf",
      "grades": [
        "g1",
        "g2",
        "g3",
        "g4",
        "g5",
        "g6",
        "g7",
        "g8",
        "g9",
        "g10",
        "g11",
        "g12",
        "g13"
      ]
    },
    {
      "id": "gartenbau",
      "label": {
        "de": "Gartenbau"
      },
      "domain": "waldorf",
      "grades": [
        "g6",
        "g7",
        "g8",
        "g9",
        "g10"
      ]
    },
    {
      "id": "handarbeit",
      "label": {
        "de": "Handarbeit"
      },
      "domain": "waldorf",
      "grades": [
        "g1",
        "g2",
        "g3",
        "g4",
        "g5",
        "g6",
        "g7",
        "g8"
      ]
    },
    {
      "id": "werken",
      "label": {
        "de": "Werken"
      },
      "domain": "waldorf",
      "grades": [
        "g5",
        "g6",
        "g7",
        "g8",
        "g9",
        "g10",
        "g11",
        "g12"
      ]
    },
    {
      "id": "formenzeichnen",
      "label": {
        "de": "Formenzeichnen"
      },
      "domain": "waldorf",
      "grades": [
        "g1",
        "g2",
        "g3",
        "g4",
        "g5"
      ]
    },
    {
      "id": "ep-de",
      "label": {
        "de": "Epoche Deutsch"
      },
      "domain": "epoch",
      "grades": [
        "g1",
        "g2",
        "g3",
        "g4",
        "g5",
        "g6",
        "g7",
        "g8",
        "g9",
        "g10",
        "g11",
        "g12"
      ],
      "kind": "epoch"
    },
    {
      "id": "ep-math",
      "label": {
        "de": "Epoche Mathematik"
      },
      "domain": "epoch",
      "grades": [
        "g1",
        "g2",
        "g3",
        "g4",
        "g5",
        "g6",
        "g7",
        "g8",
        "g9",
        "g10",
        "g11",
        "g12"
      ],
      "kind": "epoch"
    },
    {
      "id": "ep-gs",
      "label": {
        "de": "Epoche Geschichte"
      },
      "domain": "epoch",
      "grades": [
        "g5",
        "g6",
        "g7",
        "g8",
        "g9",
        "g10",
        "g11",
        "g12"
      ],
      "kind": "epoch"
    },
    {
      "id": "ep-geo",
      "label": {
        "de": "Epoche Geografie"
      },
      "domain": "epoch",
      "grades": [
        "g4",
        "g5",
        "g6",
        "g7",
        "g8",
        "g9",
        "g10",
        "g11",
        "g12"
      ],
      "kind": "epoch"
    },
    {
      "id": "ep-nawi",
      "label": {
        "de": "Epoche Naturkunde / Naturwissenschaft"
      },
      "domain": "epoch",
      "grades": [
        "g4",
        "g5",
        "g6",
        "g7",
        "g8",
        "g9",
        "g10",
        "g11",
        "g12"
      ],
      "kind": "epoch",
      "aliases": [
        "Tierkunde",
        "Pflanzenkunde",
        "Physik",
        "Chemie",
        "Astronomie"
      ]
    },
    {
      "id": "ep-kunst",
      "label": {
        "de": "Epoche Kunstgeschichte / Ästhetik"
      },
      "domain": "epoch",
      "grades": [
        "g9",
        "g10",
        "g11",
        "g12"
      ],
      "kind": "epoch"
    },
    {
      "id": "praktikum",
      "label": {
        "de": "Praktikum"
      },
      "domain": "waldorf",
      "grades": [
        "g9",
        "g10",
        "g11"
      ],
      "kind": "project",
      "aliases": [
        "Landwirtschaftspraktikum",
        "Feldmesspraktikum",
        "Sozialpraktikum",
        "Betriebspraktikum"
      ]
    },
    {
      "id": "jahresarbeit",
      "label": {
        "de": "Jahresarbeit"
      },
      "domain": "waldorf",
      "grades": [
        "g8",
        "g12"
      ],
      "kind": "project"
    },
    {
      "id": "klassenspiel",
      "label": {
        "de": "Klassenspiel"
      },
      "domain": "waldorf",
      "grades": [
        "g8",
        "g12"
      ],
      "kind": "project"
    }
  ]
}